{
  "$schema": "../../schemas/adapter.schema.json",
  "slug": "stripe",
  "name": "Stripe",
  "version": "1.0.0",
  "description": "Accept payments, manage subscriptions, and handle invoicing with Stripe.",
  "type": "payment",
  "provider": {
    "name": "Stripe",
    "website": "https://stripe.com",
    "documentation": "https://stripe.com/docs/api",
    "logo": "https://stripe.com/img/v3/home/twitter.png"
  },
  "authentication": {
    "type": "api_key",
    "fields": [
      {
        "name": "api_key",
        "label": "Secret Key",
        "type": "password",
        "required": true,
        "placeholder": "sk_live_xxx or sk_test_xxx",
        "helpText": "Your Stripe secret key. Use sk_test_xxx for sandbox testing."
      },
      {
        "name": "webhook_secret",
        "label": "Webhook Signing Secret",
        "type": "password",
        "required": false,
        "placeholder": "whsec_xxx",
        "helpText": "Webhook signing secret for verifying webhook signatures. Find this in Stripe Dashboard > Webhooks."
      }
    ],
    "testEndpoint": "/balance"
  },
  "rateLimit": {
    "requestsPerMinute": 100,
    "requestsPerHour": 1000
  },
  "icon": "stripe",
  "tags": ["payment", "subscriptions", "invoicing", "checkout", "billing"],
  "aiDescription": "Stripe adapter with full SDK access. Supports payments, subscriptions, invoices, checkout sessions, billing portal, Connect for marketplaces, and 80+ webhook events.",
  "aiInstructions": "When helping users with Stripe:\n- For one-time payments, use create_payment_intent with amount (in cents) and currency\n- For recurring billing, create a product, then a price, then a subscription\n- For hosted checkout, use create_checkout_session with line_items\n- Customer IDs start with \"cus_\", payment intents with \"pi_\", subscriptions with \"sub_\"\n- Amounts are always in the smallest currency unit (e.g., cents for USD)\n- Use metadata to store custom data on any Stripe object",
  "setupInstructions": "## Setting up Stripe\n\n1. **Get your API keys**\n   - Go to [Stripe Dashboard](https://dashboard.stripe.com/apikeys)\n   - Copy your **Secret key** (starts with `sk_test_` or `sk_live_`)\n\n2. **Configure webhooks** (optional but recommended)\n   - Go to [Stripe Webhooks](https://dashboard.stripe.com/webhooks)\n   - Add a new endpoint with your webhook URL\n   - Copy the **Signing secret** (starts with `whsec_`)\n\n3. **Test mode vs Live mode**\n   - Use `sk_test_` keys for development\n   - Switch to `sk_live_` for production"
}
